{
  "$schema": "../../../schemas/edition.schema.json",
  "date": "2026-10-27",
  "edition": "morning",
  "sample": true,
  "lead": "这是晨间示例刊，不是真实新闻。同一天可以各有一刊早报和晚报，首页显示较晚的那一刊。",
  "sections": {
    "tech": [
      {
        "title": "示例：开源社区合并了一项推理加速补丁",
        "summary": "这是占位摘要。晨刊用来和晚刊区分，正式写作时换成当天已经发生的事。",
        "sources": [
          { "name": "示例来源", "url": "https://example.com/morning-tech" }
        ]
      }
    ],
    "world": [
      {
        "title": "示例：多边会议公布下一轮谈判地点",
        "summary": "这是占位摘要。地点、时间和参与方都应该能在来源里直接找到。",
        "sources": [
          { "name": "示例来源", "url": "https://example.com/morning-world" }
        ]
      }
    ],
    "business": [
      {
        "title": "示例：交易所就停牌规则征求意见",
        "summary": "这是占位摘要。征求意见的截止日期若已公布，正式摘要里应当写上。",
        "sources": [
          { "name": "示例来源", "url": "https://example.com/morning-business" }
        ]
      }
    ],
    "china": [
      {
        "title": "示例：主管部门就新标准公开征求意见",
        "summary": "这是占位摘要。征求意见稿和新闻稿可以同时放在来源里。",
        "sources": [
          { "name": "示例来源", "url": "https://example.com/morning-china" },
          { "name": "示例原文", "url": "https://example.com/morning-china-text" }
        ]
      }
    ]
  }
}
