{
  "$schema": "../../../schemas/edition.schema.json",
  "date": "2026-10-27",
  "edition": "evening",
  "sample": true,
  "lead": "这是晚间示例刊，不是真实新闻。标题、摘要和链接都是占位，用来核对每天新增一刊之后的版式。",
  "sections": {
    "tech": [
      {
        "title": "示例：实验室公开一套可复现的模型评测",
        "summary": "这是占位摘要。正式条目会用一两句话说明发生了什么，以及为什么值得打开原文。",
        "sources": [
          { "name": "示例来源", "url": "https://example.com/tech-eval" }
        ]
      },
      {
        "title": "示例：芯片厂商上调明年的资本开支计划",
        "summary": "这是同一栏目的第二条占位。数字、公司名和影响都应来自下面的来源，而不是摘要里的发挥。",
        "sources": [
          { "name": "示例来源甲", "url": "https://example.com/chip-a" },
          { "name": "示例来源乙", "url": "https://example.com/chip-b" }
        ]
      }
    ],
    "world": [
      {
        "title": "示例：两国宣布下月恢复部长级磋商",
        "summary": "这是占位摘要。国际条目只转述已经公开的安排，不在摘要里另加判断。",
        "sources": [
          { "name": "示例来源", "url": "https://example.com/talks" }
        ]
      },
      {
        "title": "示例：议会就能源法案进入二读",
        "summary": "这是占位摘要。第二句可以补一句直接影响，但整段仍然停在两句以内。",
        "sources": [
          { "name": "示例来源", "url": "https://example.com/energy-bill" }
        ]
      }
    ],
    "business": [
      {
        "title": "示例：零售集团称季度同店销售转正",
        "summary": "这是占位摘要。市场类条目会点出关键数字，并说明它对照的是哪一个时期。",
        "sources": [
          { "name": "示例来源", "url": "https://example.com/retail" }
        ]
      },
      {
        "title": "示例：监管机构延长一起收购案的审查",
        "summary": "这是占位摘要，用来展示标题、摘要和来源分成三行时的节奏。",
        "sources": [
          { "name": "示例来源", "url": "https://example.com/merger-review" }
        ]
      }
    ],
    "china": [
      {
        "title": "示例：多个城市同日调整住房信贷细则",
        "summary": "这是占位摘要。国内条目同样只写已经公布的信息，并给出可以核对的链接。",
        "sources": [
          { "name": "示例来源", "url": "https://example.com/mortgage" }
        ]
      },
      {
        "title": "示例：统计部门发布月度物价数据",
        "summary": "这是占位摘要。若同一事实有两家来源，就并列在来源一行，不改写数字。",
        "sources": [
          { "name": "示例来源甲", "url": "https://example.com/cpi-a" },
          { "name": "示例来源乙", "url": "https://example.com/cpi-b" }
        ]
      }
    ]
  }
}
